{
  "schemaVersion": "1.1.0",
  "workoutId": "00000000-0000-4000-8000-000000000018",
  "canonical": {
    "name": "Isometric Holds",
    "slug": "isometric-holds"
  },
  "classification": {
    "workoutType": "isometric"
  },
  "structure": {
    "blocks": [
      {
        "id": "b1",
        "mode": "sequential",
        "items": [
          {
            "id": "i1",
            "exercise": {
              "id": "ex.plank",
              "name": "Plank"
            },
            "scheme": {
              "pattern": "straight",
              "sets": 3
            },
            "reps": {
              "kind": "maxHold",
              "min": 30,
              "cap": 120,
              "unit": "s"
            },
            "load": {
              "method": "bodyweight"
            },
            "rest": {
              "method": "fixed",
              "appliesTo": "set",
              "value": 60,
              "unit": "s"
            }
          }
        ],
        "role": "accessory"
      }
    ]
  },
  "metadata": {
    "createdAt": "2026-08-09T00:00:00Z",
    "updatedAt": "2026-08-09T00:00:00Z",
    "status": "active",
    "source": "vitness.core"
  }
}
