{
  "schemaVersion": "1.1.0",
  "workoutId": "00000000-0000-4000-8000-000000000016",
  "canonical": {
    "name": "Partial Reps",
    "slug": "partials"
  },
  "classification": {
    "workoutType": "hypertrophy"
  },
  "structure": {
    "blocks": [
      {
        "id": "b1",
        "mode": "sequential",
        "items": [
          {
            "id": "i1",
            "exercise": {
              "id": "ex.lateralRaise",
              "name": "Lateral Raise"
            },
            "sets": [
              {
                "index": 1,
                "reps": {
                  "kind": "fixed",
                  "value": 12
                },
                "repStyle": {
                  "rangeOfMotion": "full"
                }
              },
              {
                "index": 2,
                "reps": {
                  "kind": "toFailure",
                  "technical": true
                },
                "repStyle": {
                  "rangeOfMotion": "partial",
                  "segment": "bottom"
                },
                "notes": "Bottom-half partials taken straight after the full-range set."
              }
            ],
            "rest": {
              "method": "fixed",
              "appliesTo": "set",
              "value": 90,
              "unit": "s"
            }
          }
        ],
        "role": "accessory"
      }
    ]
  },
  "metadata": {
    "createdAt": "2026-08-09T00:00:00Z",
    "updatedAt": "2026-08-09T00:00:00Z",
    "status": "active",
    "source": "vitness.core"
  }
}
