{
  "schemaVersion": "1.1.0",
  "workoutId": "00000000-0000-4000-8000-000000000103",
  "canonical": {
    "name": "Triset",
    "slug": "triset"
  },
  "classification": {
    "workoutType": "hypertrophy"
  },
  "structure": {
    "blocks": [
      {
        "id": "b1",
        "mode": "superset",
        "items": [
          {
            "id": "i1",
            "exercise": {
              "id": "ex.lateralRaise",
              "name": "Lateral Raise"
            },
            "groupLabel": "A1",
            "reps": {
              "kind": "range",
              "min": 12,
              "max": 15
            }
          },
          {
            "id": "i2",
            "exercise": {
              "id": "ex.facePull",
              "name": "Face Pull"
            },
            "groupLabel": "A2",
            "reps": {
              "kind": "range",
              "min": 12,
              "max": 15
            }
          },
          {
            "id": "i3",
            "exercise": {
              "id": "ex.overheadPress",
              "name": "Overhead Press"
            },
            "groupLabel": "A3",
            "reps": {
              "kind": "range",
              "min": 8,
              "max": 10
            }
          }
        ],
        "role": "accessory",
        "modeParams": {
          "rounds": 3
        },
        "rest": {
          "method": "fixed",
          "appliesTo": "group",
          "value": 2,
          "unit": "min"
        }
      }
    ]
  },
  "metadata": {
    "createdAt": "2026-08-09T00:00:00Z",
    "updatedAt": "2026-08-09T00:00:00Z",
    "status": "active",
    "source": "vitness.core"
  }
}
