{
  "schemaVersion": "1.1.0",
  "workoutId": "00000000-0000-4000-8000-0000000d0104",
  "canonical": {
    "name": "Zone Two Base",
    "slug": "hr-zone"
  },
  "classification": {
    "workoutType": "endurance",
    "focus": [
      "aerobic-base"
    ]
  },
  "structure": {
    "blocks": [
      {
        "id": "b1",
        "role": "primary",
        "mode": "sequential",
        "notes": "The zone label is meaningless without its system. boundsRef names the registry entry that defines Z2; the athlete-specific beats per minute are caller context and are never carried here.",
        "items": [
          {
            "id": "i1",
            "exercise": {
              "id": "ex.bike",
              "name": "Stationary Bike"
            },
            "reps": {
              "kind": "time",
              "value": 90,
              "unit": "min"
            },
            "zone": {
              "system": "heartRate",
              "zone": "Z2",
              "boundsRef": "zone.fiveZoneHeartRate"
            }
          }
        ]
      }
    ]
  },
  "metadata": {
    "createdAt": "2026-08-10T00:00:00Z",
    "updatedAt": "2026-08-10T00:00:00Z",
    "status": "active",
    "source": "vitness.core"
  }
}
