{
  "schemaVersion": "1.1.0",
  "workoutId": "00000000-0000-4000-8000-000000000015",
  "canonical": {
    "name": "Paused Reps",
    "slug": "paused-reps"
  },
  "classification": {
    "workoutType": "strength"
  },
  "structure": {
    "blocks": [
      {
        "id": "b1",
        "mode": "sequential",
        "items": [
          {
            "id": "i1",
            "exercise": {
              "id": "ex.benchPress",
              "name": "Barbell Bench Press"
            },
            "scheme": {
              "pattern": "straight",
              "sets": 5
            },
            "reps": {
              "kind": "fixed",
              "value": 3
            },
            "tempo": {
              "eccentric": 2,
              "bottomPause": 3,
              "concentric": "X",
              "topPause": 0
            },
            "load": {
              "method": "percent1RM",
              "value": 75
            },
            "rest": {
              "method": "fixed",
              "appliesTo": "set",
              "value": 3,
              "unit": "min"
            }
          }
        ],
        "role": "primary"
      }
    ]
  },
  "metadata": {
    "createdAt": "2026-08-09T00:00:00Z",
    "updatedAt": "2026-08-09T00:00:00Z",
    "status": "active",
    "source": "vitness.core"
  }
}
