{
  "schemaVersion": "1.0.0",
  "workoutId": "00000000-0000-4000-8000-000000000105",
  "canonical": {
    "name": "Compound Set",
    "slug": "compound-set"
  },
  "classification": {
    "workoutType": "hypertrophy"
  },
  "structure": {
    "blocks": [
      {
        "id": "b1",
        "mode": "superset",
        "items": [
          {
            "id": "i1",
            "exercise": {
              "id": "ex.benchPress",
              "name": "Barbell Bench Press"
            },
            "groupLabel": "A1",
            "reps": {
              "kind": "fixed",
              "value": 8
            }
          },
          {
            "id": "i2",
            "exercise": {
              "id": "ex.dumbbellFly",
              "name": "Dumbbell Fly"
            },
            "groupLabel": "A2",
            "reps": {
              "kind": "fixed",
              "value": 12
            }
          }
        ],
        "role": "accessory",
        "modeParams": {
          "rounds": 3
        },
        "rest": {
          "method": "fixed",
          "appliesTo": "group",
          "value": 2,
          "unit": "min"
        },
        "notes": "Both items train the chest — a compound set. FDS does not distinguish this from an antagonist pairing structurally; the difference is derivable from the exercises' targets."
      }
    ]
  },
  "metadata": {
    "createdAt": "2026-08-09T00:00:00Z",
    "updatedAt": "2026-08-09T00:00:00Z",
    "status": "active",
    "source": "vitness.core"
  }
}
