{
  "schemaVersion": "1.1.0",
  "workoutId": "00000000-0000-4000-8000-0000000d0109",
  "canonical": {
    "name": "Progressive Row",
    "slug": "progressive"
  },
  "classification": {
    "workoutType": "conditioning"
  },
  "structure": {
    "blocks": [
      {
        "id": "b1",
        "role": "primary",
        "mode": "sequential",
        "notes": "Intensity climbs every five minutes and never comes back down. Each step is its own item rather than its own set, because `zone` sits on an item and not on a set \u2014 a per-set intensity ramp has no other way to be stated.",
        "items": [
          {
            "id": "i1",
            "exercise": {
              "id": "ex.rowErg",
              "name": "Rowing Ergometer"
            },
            "reps": {
              "kind": "time",
              "value": 5,
              "unit": "min"
            },
            "zone": {
              "system": "power",
              "zone": "Z2",
              "boundsRef": "zone.coggan7"
            }
          },
          {
            "id": "i2",
            "exercise": {
              "id": "ex.rowErg",
              "name": "Rowing Ergometer"
            },
            "reps": {
              "kind": "time",
              "value": 5,
              "unit": "min"
            },
            "zone": {
              "system": "power",
              "zone": "Z3",
              "boundsRef": "zone.coggan7"
            }
          },
          {
            "id": "i3",
            "exercise": {
              "id": "ex.rowErg",
              "name": "Rowing Ergometer"
            },
            "reps": {
              "kind": "time",
              "value": 5,
              "unit": "min"
            },
            "zone": {
              "system": "power",
              "zone": "Z4",
              "boundsRef": "zone.coggan7"
            }
          },
          {
            "id": "i4",
            "exercise": {
              "id": "ex.rowErg",
              "name": "Rowing Ergometer"
            },
            "reps": {
              "kind": "time",
              "value": 5,
              "unit": "min"
            },
            "zone": {
              "system": "power",
              "zone": "Z5",
              "boundsRef": "zone.coggan7"
            }
          }
        ]
      }
    ]
  },
  "metadata": {
    "createdAt": "2026-08-10T00:00:00Z",
    "updatedAt": "2026-08-10T00:00:00Z",
    "status": "active",
    "source": "vitness.core"
  }
}
